,Name,Number,Date,Weather,Emotion,Diary title,Diary
50,f14a686,일기 1,2025-07-03,,"자랑스럽다, 설레다, 기쁘다",모나리자,오늘 모나리자 그림을 그렸다. 그리기 전엔 정말 설렜다. 그림을 다 그리고 보니 기쁘고 오늘 그림은 정말 모나리자 같은 기분이 들었다.
51,f14a686,일기 2,2025-07-04,,"자랑스럽다, 행복하다, 기쁘다",청소,"오늘 반 친구들과 청소를 했다. 둘레는 혼자 했는데 내가 같이 하고 싶어 같이 했다. 복도 쓸고, 우리 반도 쓸었다. 마지막에 버릴 때 쓰레기가 많았다. 그래서 자랑스럽고 행복하고 기쁘다."
52,f14a686,일기 3,2025-07-07,,기쁘다,생존 수영,오늘 생존 수영을 했다. 음파와 발차기를 했다. 그리고 배영 같은 걸 했다. 거기 아저씨가 잘 한다고 해서 기뻤다.
53,f14a686,일기 4,2025-07-08,,즐겁다,"새우등 뜨기, 해파리등 뜨기",오늘 생존수영 가서 새우등 뜨기와 해파리등 뜨기를 했다. 새우등 뜨기는 몸을 새우처럼 구부려서 하는 거다. 해파리등 뜨기는 빛을 등지고 손을 밑으로 뻗는 거다. 생존수영을 하니 정말~~ 즐겁다.
54,f14a686,일기 5,2025-07-09,,자랑스럽다,구명 조끼,오늘 생존 수영에서 구명조끼 입는 거와 밖으로 내리는 걸 배웠다. 그리고 바다에서 앞으로 가는 법을 배웠는데 난 내가 잘한거 같아? 정말 내 자신이 자랑스러웠다.
